{
  "schemaVersion": "1.0",
  "id": "intent-pre-ba-instrument-validation",
  "projectId": "bachelor-hypergraph-augmentations",
  "researchActionId": "RA-PRE-BA-INSTRUMENT",
  "protocolId": "P-PRE-BA-INSTRUMENT",
  "hypothesisIds": [],
  "objective": "Verify deterministic Star Expansion, A0 budget preservation, structural metrics and provenance before using claim-bearing datasets.",
  "constraints": {
    "dataset": ["fixture:toy"],
    "strategy": ["A0"],
    "rho": [0.1, 0.25],
    "seed": [0, 1, 42]
  },
  "repositoryRef": { "branch": "main" },
  "createdAt": "2026-09-03T00:00:00Z"
}
